Name,Type,Description,Policy Area,Introduced,Sponsor,Coauthors,Committees,Link,Introduced,Failed Assembly Committee,Passed Assembly Committee,Failed Assembly,Passed Assembly,Failed Senate Committee,Passed Senate Committee,Failed Senate,Passed Senate,Resolving Differences,To Governor,Veto,Became Law
A.B. 14,Bill,Internet for All Act of 2021,Communications,12/16/20,Asm. Cecilia Aguiar-Curry (D-Winters),,Communications and conveyance/Local government,https://leginfo.legislature.ca.gov/faces/billTextClient.xhtml?bill_id=202120220AB14,TRUE,FALSE,FALSE,FALSE,FALSE,FALSE,FALSE,FALSE,FALSE,FALSE,FALSE,FALSE,FALSE
Introduced by,Principal coauthors,Coauthors,,,,,,,,,,,,,,,,,,,
"Assembly Members Aguiar-Curry, Bloom, Bonta, Cristina Garcia, Eduardo Garcia, Low, Petrie-Norris, Quirk, Quirk-Silva, Reyes, Robert Rivas, Santiago, Stone, and Weber","Assembly Members Bauer-Kahan, Carrillo, and Irwin, Senators Eggman and Gonzalez","Assembly Members Burke, Muratsuchi, Blanca Rubio, Wicks, and Wood, Senators Limón and McGuire",,,,,,,,,,,,,,,,,,,
Date,Action,Description,,,,,,,,,,,,,,,,,,,
12/7/20,Read for the first time and sent to print.,"H.Res. 24 is the article of impeachment for President Donald J. Trump, charging that he incited violence against the American government in attempting to overturn the results of the presidential election, leading to the storming of the Capitol by his supporters. The article also calls for him to be disqualified from ever holding office again.",,,,,,,,,,,,,,,,,,,
12/8/20,Received from printer. May be heard in committee on January 7.,"All 222 House Democrats voted for impeachment, along with 10 Republicans, the most members of the president’s party out of all four impeachments. Trump is the first president to be impeached twice, and will face a trial in the Senate, likely after he leaves office on January 20.",,,,,,,,,,,,,,,,,,,
1/11/21,Referred to two Assembly committees,,,,,,,,,,,,,,,,,,,,